{
    "schemaVersion": 2,
    "catalogId": "test",
    "catalogName": "RGM Compatibility Test",
    "revision": 1,
    "generatedAt": "2026-08-11T00:00:00Z",
    "minimumAppVersionCode": 2,
    "files": [
        {
            "path": "catalog.json",
            "objectPath": "objects/sha256/a46840996ed5d4f4d45e6abd642eaccc366834a881edeb8c2a239b20abea6968",
            "bytes": 1400,
            "sha256": "a46840996ed5d4f4d45e6abd642eaccc366834a881edeb8c2a239b20abea6968"
        },
        {
            "path": "moo1/1.3/profile.json",
            "objectPath": "objects/sha256/84b7862646b4006c6d509a5fc9d0b9bace5544355dbb489c4961267f6d0a6488",
            "bytes": 39548,
            "sha256": "84b7862646b4006c6d509a5fc9d0b9bace5544355dbb489c4961267f6d0a6488"
        },
        {
            "path": "moo1/resolve.json",
            "objectPath": "objects/sha256/091e9d235e794a4259ba73ca24b7f32314974cf585a6fa3321dee69531afc887",
            "bytes": 1150,
            "sha256": "091e9d235e794a4259ba73ca24b7f32314974cf585a6fa3321dee69531afc887"
        }
    ]
}
